{
  "ref": "ollama/llama3.1:70b",
  "providerName": "ollama",
  "modelName": "llama3.1:70b",
  "displayName": "Llama 3.1 70B (local)",
  "family": "llama",
  "version": "3.1",
  "hosting": "local",
  "capabilities": [
    "chat",
    "tools",
    "json-mode",
    "json-schema",
    "streaming",
    "system-prompt",
    "seed",
    "stop-sequences"
  ],
  "contextWindowTokens": 131072,
  "maxOutputTokens": 8192,
  "inputModalities": [
    "text"
  ],
  "maxSensitivity": "restricted",
  "knowledgeCutoff": "2024-12"
}
